{
  "created_at": "2026-07-22T10:29:26.436575+09:00",
  "history_hash": "826d51b6635265929f5e43beecb8a5d7fad3d783ad1f0dcea3f9e06c88173f02",
  "history_id": "repair_history_8a186210b4e147641489",
  "invalidation_manifest_hash": "5e9e8cb6255a9f9907a2903cf4432ed191c3bd1f4e208203efbe5ac54c476944",
  "repair_plan_hash": "66774f6af9d3c3ac4ba6bd84b53d64d63101d181bc77c8757862db8dbeb1edd9",
  "schema_name": "phase6_repair_history",
  "schema_version": "1.0.0",
  "status": "CONVERGED",
  "timezone": "Asia/Seoul",
  "waves": [
    {
      "after_repaired_sha256": "8130f47caa5decf4e1df5343f405fcc79ff18f6d7c6e1880d7e56733d45ae20b",
      "before_faulty_sha256": "ed30ddbd3f390b705a1e90bb134d93c33496b32decc3d21473b5221991cc781c",
      "canonical_repair_owner": "src/presentation_agent/deckcompiler/qa/reconstruction_source/slides.js",
      "composite_qa": "PASS",
      "direct_output_patch": false,
      "evidence": {
        "composite_qa": "PASS",
        "composite_report_hash": "87ca613e1fe5f7ef8edb842e3d3f470611f8471259bc27c72cbd547afe6aaa1d",
        "dimension_mismatch_count": 0,
        "evidence_capsule_manifest_hash": "2e51b62976d4b2b26dbe649722bb15bd073d4710a6fa5682d544d6629570f092",
        "expected_finding_resolved": true,
        "external_reconciliation": "PASS",
        "external_reconciliation_report_hash": "8709c5707c376ef6ad9a884082b159f1075c2a831512b999d83ea89b5757b640",
        "fault_state": "repaired",
        "full_capture_browser": "Playwright Chromium 149.0.7827.55",
        "full_capture_validation_status": "PASS",
        "hash_mismatch_count": 0,
        "html_screenshot_capture_manifest_hash": "1d2404d1af6cbd1dc79303ae45875cb4039d45c04497966ddf34e491b8c5ee05",
        "html_screenshot_count": 6,
        "html_screenshot_sha256_by_slide": {
          "slide-001": "17ca4cea2f906ba914242fc125f14f8fa193c634d95be811e92e8b800070a239",
          "slide-002": "42a157f7e487e502aa36d802cbdc03c9d088e3b0969c2ce3e3f681eff18bb35c",
          "slide-003": "3eb9ca98f015e8edf488bb751f3879421ddfb3fa79d2cb24b9864f129392bc4f",
          "slide-004": "4131a29dc424e47859c99305c79d2cd4e7002e6df92b68e31f750791045a027a",
          "slide-005": "3584f50713140074979e6abcda9f8db606f0e8e8a21da58686df875d125e746e",
          "slide-006": "e6a06240c84fcdc1fdf98ee0d4598fcd1d843c14622a87966cc8934c9f2e8047"
        },
        "html_sha256": "4569882c7153f6e846b350df68322fa820adf7ff34508dc4aac07be2834e19a7",
        "micro_capture_manifest_hash": "ca456779a0e20a73b45b0f43e8a850b297825c3fa3d9d3b4e13300fd2580bbb1",
        "micro_capture_validation_status": "PASS",
        "missing_artifact_count": 0,
        "native_editability": 1.0,
        "new_severe_finding_count": 0,
        "objective_evidence_hash": "e45e0b31b7d67636c62a335b2cf3ca92575aa5d97043697f6244f87f8fbb90b6",
        "official_final_gate": "PASS",
        "pptx_html_parity": 1.0,
        "pptx_render_sha256_by_slide": {
          "slide-001": "1d9753e704f776238d07862082540ee78dbc64630d50a8136e43151a28633684",
          "slide-002": "95da832e8af843baa86227eddd0933ee122d3238d4264a6fdd1647746c1df13e",
          "slide-003": "8da4216332f596e20de3df53e34c1592c5b31818181f06e64b21f06ca2f2901f",
          "slide-004": "855ae16e06b6e3c70aa795a7ce8feac03d699327135f2e5aff320c94e7a064a8",
          "slide-005": "1a9ecda45b6d0d475425dd84b83b441deeb8f040357c3a97fc6af43caf5659e2",
          "slide-006": "6f838b7d761103fea32ed7d90872db13d764ba088f6b0e3f7c159b5e160aa870"
        },
        "pptx_sha256": "6fd3fa50cab6d56c8fe943b515e93d36dde485a843e34b0ea710890ac8c845a5",
        "prior_runtime_reused": false,
        "raster_violation_count": 0,
        "render_count": 6,
        "repaired_micro_canary_count": 2,
        "run_id": "phase61c-repaired-854def7e99eb40388a724ad8",
        "semantic_fidelity": 1.0,
        "source_commit": "21bcd35e5919dc340e01be74ced0a51f23931f08",
        "source_coverage": 1.0,
        "stale_artifact_count": 0,
        "timeout_count": 0,
        "upstream_sha256": "8130f47caa5decf4e1df5343f405fcc79ff18f6d7c6e1880d7e56733d45ae20b"
      },
      "expected_finding_resolved": true,
      "external_reconciliation": "PASS",
      "new_severe_finding_count": 0,
      "official_final_gate": "PASS",
      "prior_runtime_reused": false,
      "repair_action": "rematerialize_canonical_owner",
      "run_id": "phase61c-repaired-854def7e99eb40388a724ad8",
      "source_commit": "21bcd35e5919dc340e01be74ced0a51f23931f08",
      "status": "CONVERGED",
      "wave": 1
    }
  ],
  "waves_allowed": 3,
  "waves_used": 1
}
